Title,Description,ISBN,Author,Genre,Pages,Age Range,Price,Qty.
The Dutch House,"At the end of the Second World War, Cyril Conroy combines luck and a single canny investment to begin an enormous real estate empire, propelling his family from poverty to enormous wealth. His first order of business is to buy the Dutch House, a lavish estate in the suburbs outside of Philadelphia. Meant as a surprise for his wife, the house sets in motion the undoing of everyone he loves.",9780062963673,Ann Patchett,Coming-Of-Age Fiction,352,15-35,$27.99,20
Movies (And Other Things),"#1 New York Times bestselling author Shea Serrano is back, and his new book, Movies (And Other Things), combines the fury of a John Wick shootout, the sly brilliance of Regina George holding court at a cafeteria table, and the sheer power of a Denzel monologue, all into one.",1538730197,Shea Serrano,Movie History & Criticism,256,14-84,$17.50,30
The Very Hungry Caterpillar,"THE all-time classic picture book, from generation to generation, sold somewhere in the world every 30 seconds! Have you shared it with a child or grandchild in your life?",0399226907,Eric Carle,Children,26,3-12,$9.99,15 
Super Pumped: The Battle for Uber,"A New York Times technology correspondent presents the dramatic story of Uber, the Silicon Valley startup at the center of one of the great venture capital power struggles of our time.",0393652246,Mike Isaac,History,408,18-88,$23.71,7
C Programming Language,"The authors present the complete guide to ANSI standard C language programming. Written by the developers of C, this new version helps readers keep up with the finalized ANSI standard for C while showing how to take advantage of C's rich set of operators, economy of expression, improved control flow, and data structures. The 2/E has been completely rewritten with additional examples and problem sets to clarify the implementation of difficult language constructs. For years, C programmers have let K&R guide them to building well-structured and efficient programs. Now this same help is available to those working with ANSI compilers. Includes detailed coverage of the C language plus the official C language reference manual for at-a-glance help with syntax notation, declarations, ANSI changes, scope rules, and the list goes on and on.",0131103628,Brian Kernighan,Textbook,272,20-40,$108.81,118
